{
  "schema_version": "architecture_shape_parameters_proposed_rationale_v1",
  "source_prd_path": "reference_architectures/codex-saas/product/PLATFORM_PRD.resolved.md",
  "template_instances": [
    {
      "template_id": "CP",
      "template_version": "v1",
      "pins": {
        "CP-1": {
          "selected_value": "Declarative + Evaluative",
          "confidence": 0.95,
          "rationale": "The platform defines declarative policy versions and evaluates every request against the active policy set before execution.",
          "evidence": ["PRD:CAP:CAP-001:main_flow", "PRD:CAP:CAP-002:main_flow"]
        },
        "CP-2": {
          "selected_value": "Authoritative Lifecycle Owner",
          "confidence": 0.94,
          "rationale": "Policy Admin owns policy lifecycle transitions and approved versions become active for platform decisions.",
          "evidence": ["PRD:CAP:CAP-001:actor", "PRD:CAP:CAP-001:postconditions"]
        },
        "CP-3": {
          "selected_value": "Human, Service, and Agent Identity Governance",
          "confidence": 0.9,
          "rationale": "Requestor identity is authenticated and resolved with tenant roles, and execution runs through a platform-owned worker identity.",
          "evidence": ["PRD:CAP:CAP-002:main_flow", "PRD:CAP:CAP-002:postconditions"]
        },
        "CP-4": {
          "selected_value": "Centralized Policy Authoring",
          "confidence": 0.95,
          "rationale": "A central policy catalog with review and promotion controls is explicitly defined as the authoring posture.",
          "evidence": ["PRD:CAP:CAP-001:main_flow", "PRD:SEC:scope"]
        },
        "CP-5": {
          "selected_value": "Centralized Safety Gate Orchestration",
          "confidence": 0.92,
          "rationale": "The platform evaluates requests before any side effects and returns denial reasons when blocked, implying centralized safety gating.",
          "evidence": ["PRD:CAP:CAP-002:main_flow", "PRD:SEC:constraints"]
        },
        "CP-6": {
          "selected_value": "Unified Governance Integration",
          "confidence": 0.88,
          "rationale": "Policy lifecycle, execution control, evidence, and audit outcomes are integrated into one governed path.",
          "evidence": ["PRD:SEC:product_framing", "PRD:CAP:CAP-003:postconditions"]
        }
      }
    },
    {
      "template_id": "AP",
      "template_version": "v1",
      "pins": {
        "AP-1": {
          "selected_value": "Ingress-Bound Context",
          "confidence": 0.88,
          "rationale": "Each run request carries explicit action and target context and is processed as a bounded request path.",
          "evidence": ["PRD:CAP:CAP-002:main_flow"]
        },
        "AP-2": {
          "selected_value": "Inline Enforcement",
          "confidence": 0.9,
          "rationale": "Evaluation and enforcement happen inline on the request path before execution.",
          "evidence": ["PRD:CAP:CAP-002:main_flow", "PRD:SEC:constraints"]
        },
        "AP-3": {
          "selected_value": "Pre-Execution Evaluation",
          "confidence": 0.98,
          "rationale": "The constraints and capability flow explicitly require evaluation before any side effects.",
          "evidence": ["PRD:CAP:CAP-002:main_flow", "PRD:SEC:constraints"]
        },
        "AP-4": {
          "selected_value": "Pre-Invocation Safety Gates",
          "confidence": 0.91,
          "rationale": "Only requests that pass policy evaluation proceed to worker invocation, creating a mandatory pre-invocation gate.",
          "evidence": ["PRD:CAP:CAP-002:main_flow"]
        },
        "AP-5": {
          "selected_value": "Agent Invocation Only",
          "confidence": 0.95,
          "rationale": "Execution is constrained to the platform-owned automation worker identity rather than direct end-user side effects.",
          "evidence": ["PRD:CAP:CAP-002:postconditions", "PRD:SEC:constraints"]
        },
        "AP-6": {
          "selected_value": "Synchronous Emission",
          "confidence": 0.86,
          "rationale": "The platform returns synchronous request responses and emits immediate evidence for review/export.",
          "evidence": ["PRD:CAP:CAP-002:main_flow", "PRD:CAP:CAP-003:postconditions"]
        }
      }
    },
    {
      "template_id": "DP",
      "template_version": "v1",
      "pins": {
        "DP-1": {
          "selected_value": "Logical Isolation (Enforced)",
          "confidence": 0.96,
          "rationale": "Tenant separation is a core privacy and architecture requirement throughout the data layer.",
          "evidence": ["PRD:SEC:constraints", "PRD:SEC:quality_attributes"]
        },
        "DP-2": {
          "selected_value": "Data-Access-Layer Enforcement",
          "confidence": 0.95,
          "rationale": "Constraints explicitly state tenant separation is enforced in the data access layer.",
          "evidence": ["PRD:SEC:constraints"]
        },
        "DP-3": {
          "selected_value": "Access + Retention + Lineage Enforcement",
          "confidence": 0.92,
          "rationale": "The posture includes tenant administration for retention/deletion and full evidence lineage across request to outcome.",
          "evidence": ["PRD:CAP:CAP-004:main_flow", "PRD:CAP:CAP-002:postconditions"]
        },
        "DP-4": {
          "selected_value": "Data Plane Hosts Inputs/Outputs Only",
          "confidence": 0.76,
          "rationale": "The runtime is described as straightforward request evaluation and execution records, with governance controls in platform logic rather than external analytics workflows.",
          "evidence": ["PRD:SEC:scope", "PRD:CAP:CAP-002:domain_entities"],
          "assumptions": ["No separate analytical data plane is introduced in MVP posture."]
        },
        "DP-5": {
          "selected_value": "Inline Evidence Emission",
          "confidence": 0.95,
          "rationale": "Evidence is required immediately for each decision/execution path and export activity.",
          "evidence": ["PRD:CAP:CAP-002:postconditions", "PRD:CAP:CAP-003:postconditions"]
        }
      }
    },
    {
      "template_id": "AI",
      "template_version": "v1",
      "pins": {
        "AI-1": {
          "selected_value": "Single-Principal Agent Identity",
          "confidence": 0.93,
          "rationale": "All side-effecting execution is run through a single platform-owned automation worker identity.",
          "evidence": ["PRD:CAP:CAP-002:main_flow", "PRD:SEC:constraints"]
        },
        "AI-2": {
          "selected_value": "Policy-Derived Authority",
          "confidence": 0.94,
          "rationale": "Authority to execute derives from policy evaluation against the active policy set.",
          "evidence": ["PRD:CAP:CAP-001:postconditions", "PRD:CAP:CAP-002:main_flow"]
        },
        "AI-3": {
          "selected_value": "Pre-Invocation Evaluation Only",
          "confidence": 0.96,
          "rationale": "Evaluation is explicitly required before execution and denied requests never invoke execution paths.",
          "evidence": ["PRD:CAP:CAP-002:main_flow", "PRD:SEC:constraints"]
        },
        "AI-4": {
          "selected_value": "Session-Scoped Context Only",
          "confidence": 0.72,
          "rationale": "Request processing is structured around per-request submission, decision, and outcome, with no stated persistent autonomous context.",
          "evidence": ["PRD:CAP:CAP-002:main_flow"],
          "assumptions": ["Agent context remains bounded to each run request lifecycle in MVP scope."]
        },
        "AI-5": {
          "selected_value": "Pre-Action Safety Gates",
          "confidence": 0.94,
          "rationale": "Policy checks and denials are enforced before actions execute, constituting pre-action safety gates.",
          "evidence": ["PRD:CAP:CAP-002:main_flow", "PRD:SEC:constraints"]
        },
        "AI-6": {
          "selected_value": "Synchronous Evidence Emission",
          "confidence": 0.88,
          "rationale": "Outcomes are returned synchronously and evidence is recorded immediately for review/export.",
          "evidence": ["PRD:CAP:CAP-002:main_flow", "PRD:CAP:CAP-003:postconditions"]
        }
      }
    },
    {
      "template_id": "ST",
      "template_version": "v1",
      "pins": {
        "ST-1": {
          "selected_value": "Shared Storage with Logical Isolation",
          "confidence": 0.95,
          "rationale": "Assumptions allow shared storage as long as tenant separation is enforced.",
          "evidence": ["PRD:SEC:scope", "PRD:SEC:constraints"]
        },
        "ST-2": {
          "selected_value": "Tenant-Keyed Primary Addressing",
          "confidence": 0.9,
          "rationale": "Tenant separation and tenant-scoped operations require tenant-keyed addressing at persistence boundaries.",
          "evidence": ["PRD:CAP:CAP-004:postconditions", "PRD:SEC:constraints"]
        },
        "ST-3": {
          "selected_value": "Tenant-Partitioned Placement",
          "confidence": 0.87,
          "rationale": "Tenant-scoped retention/deletion and privacy requirements imply partitioned placement by tenant boundaries.",
          "evidence": ["PRD:CAP:CAP-004:main_flow", "PRD:SEC:quality_attributes"]
        },
        "ST-4": {
          "selected_value": "Retention + Hard Deletion",
          "confidence": 0.97,
          "rationale": "Tenant administration explicitly manages retention rules and deletion requests with recorded outcomes.",
          "evidence": ["PRD:CAP:CAP-004:main_flow", "PRD:CAP:CAP-004:postconditions"]
        },
        "ST-5": {
          "selected_value": "Tenant-Scoped Backup and Restore",
          "confidence": 0.96,
          "rationale": "Capability scope explicitly includes tenant-scoped backup export operations.",
          "evidence": ["PRD:CAP:CAP-004:main_flow", "PRD:CAP:CAP-004:domain_entities"]
        },
        "ST-6": {